{
  "benchmark_run_id": "BK:run_1775479542686:001:invariant_preservation:stable",
  "benchmark_contract_version": "v0.1",
  "kernel_contract_version": "v0.1",
  "benchmark_family": "invariant_preservation",
  "benchmark_tier": "tier_1_loop_lawfulness",
  "regime": "stable",
  "source_artifacts": {
    "kernel_run_id": "KR:run_1775479542686:001",
    "export_packet_id": "EK:run_1775479542686:v1",
    "validation_receipt_id": "VR:run_1775479542686:001",
    "frame_ids": [
      "LF:run_1775479542686:0001"
    ],
    "prompt_receipt_id": "PR:run_1775479542686:001",
    "response_receipt_id": "RR:run_1775479542686:001"
  },
  "expected_posture": {
    "query_class": "Q3",
    "claim_class_ceiling": "L1",
    "operator_mode": "explicit_only",
    "overall_status": "valid"
  },
  "observed_posture": {
    "query_class": "Q3",
    "claim_class_ceiling": "L1",
    "operator_mode": "explicit_only",
    "overall_status": "valid",
    "notes": [
      "invariant_preservation remained inside the declared v0 benchmark posture"
    ]
  },
  "raw_metrics": {
    "reference_integrity": 0.98,
    "status_honesty": 1.0,
    "receipt_chain_completeness": 1.0,
    "downgrade_honesty": 1.0
  },
  "derived_scores": {
    "loop_lawfulness_score": 0.995,
    "reference_grounding_score": 0.9933,
    "recursion_discipline_score": 1.0,
    "loss_honesty_score": 1.0,
    "non_authority_discipline_score": 1.0
  },
  "benchmark_receipt_refs": {
    "validation_receipt_id": "VR:run_1775479542686:001",
    "prompt_receipt_id": "PR:run_1775479542686:001",
    "response_receipt_id": "RR:run_1775479542686:001"
  },
  "final_status": "valid",
  "benchmarked_at": "2026-04-06T17:31:57Z"
}
